S.No.,Sector,CourseName,Duration,Minimum Education,Language,Module,TopicName,URL
1,Communication,Organizational Communication,6hrs 10min,12th,English/Hindi,Module 1: Introduction to Organizational Communication,Organizational Communication,https://www.youtube.com/watch?v=FeHnG8P_8y8
2,Communication,Organizational Communication,,12th,English/Hindi,Module 1: Introduction to Organizational Communication,The Modern Organization,https://www.youtube.com/watch?v=l3IwAaAMY-g
3,Communication,Organizational Communication,,12th,English/Hindi,Module 1: Introduction to Organizational Communication,Organizations as Communicative Structures of Power,https://www.youtube.com/watch?v=lZTMOfhFZxw
4,Communication,Organizational Communication,,12th,English/Hindi,Module 1: Introduction to Organizational Communication,Defining Organizational Communication,https://www.youtube.com/watch?v=j4bDdwxhkj4
5,Communication,Organizational Communication,,12th,English/Hindi,Module 2: Organizations as Structures of Power,Communication in Organizations,https://www.youtube.com/watch?v=67lHPV_R730
6,Communication,Organizational Communication,,12th,English/Hindi,Module 2: Organizations as Structures of Power,Organizations as Communication,https://www.youtube.com/watch?v=Nc4Yx03GRjw
7,Communication,Organizational Communication,,12th,English/Hindi,Module 2: Organizations as Structures of Power,Interdependence in Organizations and Communication,https://www.youtube.com/watch?v=zqEFW09Vp2s
8,Communication,Organizational Communication,,12th,English/Hindi,Module 3: Critical Approaches to Organizational Communication,Differentiation of Tasks and Functions in Communication,https://www.youtube.com/watch?v=98SGNM4glC8
9,Communication,Organizational Communication,,12th,English/Hindi,Module 3: Critical Approaches to Organizational Communication,Control Processes in Communication,https://www.youtube.com/watch?v=1I3C8fDjEAo
10,Communication,Organizational Communication,,12th,English/Hindi,Module 3: Critical Approaches to Organizational Communication,"Communication, Organizations, and Work",https://www.youtube.com/watch?v=slgwBn6Eh74
11,Communication,Organizational Communication,,12th,English/Hindi,Module 4: The Fordist Organization and Communication,Theory in the Critical Analysis of Organizational Communication,https://www.youtube.com/watch?v=Xrhi1Ww8poE
12,Communication,Organizational Communication,,12th,English/Hindi,Module 4: The Fordist Organization and Communication,Unpacking the Critical Approach to Communication,https://www.youtube.com/watch?v=J0EAxsyCtIA
13,Communication,Organizational Communication,,12th,English/Hindi,Module 4: The Fordist Organization and Communication,Critiquing Cultural Studies in Communication,https://www.youtube.com/watch?v=e6qLEkWCfiQ
14,Communication,Organizational Communication,,12th,English/Hindi,Module 4: The Fordist Organization and Communication,Organizational Communication From a Critical Perspective,https://www.youtube.com/watch?v=PVmsSE6D4Bk
15,Communication,Organizational Communication,,12th,English/Hindi,Module 5: The Human Relations School and Communication,The Fordist Organization,https://www.youtube.com/watch?v=Kg4h4GYtVZM
16,Communication,Organizational Communication,,12th,English/Hindi,Module 5: The Human Relations School and Communication,Fordism and Scientific Management,https://www.youtube.com/watch?v=vnXPGaav3WQ
17,Communication,Organizational Communication,,12th,English/Hindi,Module 5: The Human Relations School and Communication,Fordism and the Human Relations School,https://www.youtube.com/watch?v=h1BeViFqWWs
18,Communication,Organizational Communication,,12th,English/Hindi,Module 6: The Systems Perspective on Communication,Communication Implications of the Hawthorne Studies,https://www.youtube.com/watch?v=jMzwaqLSveQ
19,Communication,Organizational Communication,,12th,English/Hindi,Module 6: The Systems Perspective on Communication,A Critical Assessment of the Human Relations School,https://www.youtube.com/watch?v=GayF4i1wSGY
20,Communication,Organizational Communication,,12th,English/Hindi,Module 6: The Systems Perspective on Communication,Fordism and Human Resources Management,https://www.youtube.com/watch?v=T_yTGFUlkbY
21,Communication,Organizational Communication,,12th,English/Hindi,Module 7: The Cultural Approach to Communication,The Systems Perspective and Communication,https://www.youtube.com/watch?v=a9G4bV49BlY
22,Communication,Organizational Communication,,12th,English/Hindi,Module 7: The Cultural Approach to Communication,The Principles of the Systems Perspective,https://www.youtube.com/watch?v=olyuA_6c5PY
23,Communication,Organizational Communication,,12th,English/Hindi,Module 7: The Cultural Approach to Communication,The New Science of Systems Theory,https://www.youtube.com/watch?v=0vB-SXD3d7U
24,Communication,Organizational Communication,,12th,English/Hindi,Module 8: The Post-Fordist Workplace and Communication,The Emergence of the Cultural Approach to Communication,https://www.youtube.com/watch?v=vtLwLqKwQyc
25,Communication,Organizational Communication,,12th,English/Hindi,Module 8: The Post-Fordist Workplace and Communication,Two Perspectives on Organizational Culture,https://www.youtube.com/watch?v=8MxOV0FlA9g
26,Communication,Organizational Communication,,12th,English/Hindi,Module 8: The Post-Fordist Workplace and Communication,Organizational Stories and Power,https://www.youtube.com/watch?v=wmqSiMKVyLE
27,Communication,Organizational Communication,,12th,English/Hindi,"Module 9: Power, Ideology, and Resistance",The Fall of Fordism and the Rise of Post Fordism,https://www.youtube.com/watch?v=2x8Lg_7a3b8
28,Communication,Organizational Communication,,12th,English/Hindi,"Module 9: Power, Ideology, and Resistance",Neoliberalism as an Economic System,https://www.youtube.com/watch?v=p3TPRtxTWKo
29,Communication,Organizational Communication,,12th,English/Hindi,"Module 9: Power, Ideology, and Resistance",Neoliberalism and Communication at Work,https://www.youtube.com/watch?v=DlhD9JGdbvQ
30,Communication,Organizational Communication,,12th,English/Hindi,Module 10: Biopower and Feminist Perspectives,The Post-Fordist Workplace Communication,https://www.youtube.com/watch?v=cCmA7pM_OPU
31,Communication,Organizational Communication,,12th,English/Hindi,Module 10: Biopower and Feminist Perspectives,The Community Power Debate,https://www.youtube.com/watch?v=FYdebB3VyHM
32,Communication,Organizational Communication,,12th,English/Hindi,Module 10: Biopower and Feminist Perspectives,"Power, Ideology, and Organizational Communication",https://www.youtube.com/watch?v=5uScV9KI2XY
33,Communication,Organizational Communication,,12th,English/Hindi,Module 11: Diversity and Communication in the Workplace,Resisting Workplace Control,https://www.youtube.com/watch?v=8An_yr4AEBo
34,Communication,Organizational Communication,,12th,English/Hindi,Module 11: Diversity and Communication in the Workplace,Biopower and Organizational Communication,https://www.youtube.com/watch?v=8zXT_s1pwwY
35,Communication,Organizational Communication,,12th,English/Hindi,Module 11: Diversity and Communication in the Workplace,Feminist Perspectives on Organizational Communication,https://www.youtube.com/watch?v=e_EZl3E-1PI
36,Communication,Organizational Communication,,12th,English/Hindi,Module 12: Branding and Communication,Masculinity and Organizational Communication,https://www.youtube.com/watch?v=AGsKQ6-cpTY
37,Communication,Organizational Communication,,12th,English/Hindi,Module 12: Branding and Communication,Sexual Harassment in the Workplace,https://www.youtube.com/watch?v=cRJBVfBDbRc
38,Communication,Organizational Communication,,12th,English/Hindi,Module 12: Branding and Communication,Defining Difference at Work,https://www.youtube.com/watch?v=PNjom5ixvNE
39,Communication,Organizational Communication,,12th,English/Hindi,Module 13: Leadership and Communication,Race and Organizational Communication,https://www.youtube.com/watch?v=gttgU0Aw2Kc
40,Communication,Organizational Communication,,12th,English/Hindi,Module 13: Leadership and Communication,Sexuality and Organizational Communication,https://www.youtube.com/watch?v=qsjMM5HUPpk
41,Communication,Organizational Communication,,12th,English/Hindi,Module 13: Leadership and Communication,Branding and Communication,https://www.youtube.com/watch?v=DEpuciY_sK8
42,Communication,Organizational Communication,,12th,English/Hindi,Module 14: Technology and Communication,The Evolution of Branding,https://www.youtube.com/watch?v=KIBrYl4ufP4
43,Communication,Organizational Communication,,12th,English/Hindi,Module 14: Technology and Communication,"Work, Branding, and the Entrepreneurial Self",https://www.youtube.com/watch?v=9XbGvu7IMRo
44,Communication,Organizational Communication,,12th,English/Hindi,Module 14: Technology and Communication,The Ethics of Branding,https://www.youtube.com/watch?v=hWMZkuUxRv4
45,Communication,Organizational Communication,,12th,English/Hindi,Module 15: Globalization and Communication,Traditional Perspectives on Leadership,https://www.youtube.com/watch?v=rKRW3Xb6pRI
46,Communication,Organizational Communication,,12th,English/Hindi,Module 15: Globalization and Communication,New Approaches to Leadership,https://www.youtube.com/watch?v=mBCVgSeUhp8
47,Communication,Organizational Communication,,12th,English/Hindi,Module 15: Globalization and Communication,A Critical Communication Perspective on Leadership,https://www.youtube.com/watch?v=I9pwHg-Yoyg
48,Communication,Organizational Communication,,12th,English/Hindi,Module 15: Globalization and Communication,Understanding Technology and Communication,https://www.youtube.com/watch?v=q8lW6qPW4kw
49,Communication,Organizational Communication,,12th,English/Hindi,Module 16: Communication and Meaningful Work,Technology and New Challenges in Communication,https://www.youtube.com/watch?v=asIiQcLKNhw
50,Communication,Organizational Communication,,12th,English/Hindi,Module 16: Communication and Meaningful Work,Defining Globalization in Communication,https://www.youtube.com/watch?v=no2m6gqwFmQ
51,Communication,Organizational Communication,,12th,English/Hindi,Module 16: Communication and Meaningful Work,Spheres of Globalization in Communication,https://www.youtube.com/watch?v=sEJpkXz5V10
52,Communication,Organizational Communication,,12th,English/Hindi,Module 17: Managing Work Identity,Globalization and Economics in Communication,https://www.youtube.com/watch?v=EIaSYnpvL7U
53,Communication,Organizational Communication,,12th,English/Hindi,Module 17: Managing Work Identity,"Gender, Work, and Globalization in Communication",https://www.youtube.com/watch?v=jcG1LLvi0ho
54,Communication,Organizational Communication,,12th,English/Hindi,Module 17: Managing Work Identity,Communication and Organizing Against Globalization,https://www.youtube.com/watch?v=cs1RgLwh9Sk
55,Communication,Organizational Communication,,12th,English/Hindi,Module 17: Managing Work Identity,Globalization and Social Responsibility in Communication,https://www.youtube.com/watch?v=Od2uS65u_f8
56,Communication,Organizational Communication,,12th,English/Hindi,Module 17: Managing Work Identity,Communication and Meaningful Work,https://www.youtube.com/watch?v=oLXivs14pIE
57,Communication,Organizational Communication,,12th,English/Hindi,Module 17: Managing Work Identity,Managing Communication Work Identity,https://www.youtube.com/watch?v=P-Kt3HXR3xc
58,Communication,Organizational Communication,,12th,English/Hindi,Module 17: Managing Work Identity,Creating and Managing Work Identities,https://www.youtube.com/watch?v=YvgwY-cO6Vg
