S.No.,Sector,CourseName,Duration,Minimum Education,Language,Module,TopicName,URL
1,Artificial Intelligence,Human-AI Interaction,8hrs 21min,12th,English/Hindi,Module 1: Algorithmic Bias in AI,"AI, Ain't I A Woman? - Joy Buolamwini",https://www.youtube.com/watch?v=QxuyfWoVV98
2,Artificial Intelligence,Human-AI Interaction,,12th,English/Hindi,Module 1: Algorithmic Bias in AI,"Design Is [Empathic] – A Talk on Empathy, Humanity and Designing AI",https://www.youtube.com/watch?v=xPlwoFRSq_0
3,Artificial Intelligence,Human-AI Interaction,,12th,English/Hindi,Module 1: Algorithmic Bias in AI,Designing Human-Centered AI Products  (Google I/O'19),https://www.youtube.com/watch?v=rf83vRxLWFQ
4,Artificial Intelligence,Human-AI Interaction,,12th,English/Hindi,Module 1: Algorithmic Bias in AI,The danger of AI is weirder than you think | Janelle Shane,https://www.youtube.com/watch?v=OhCzX0iLnOc
5,Artificial Intelligence,Human-AI Interaction,,12th,English/Hindi,Module 2: Designing Ethical AI ,"Zoombombing, Technology Ethics & Awful People Being Awful | An Introduction to Ethical Debt in Tech",https://www.youtube.com/watch?v=KI_3sF3SPq8
6,Artificial Intelligence,Human-AI Interaction,,12th,English/Hindi,Module 2: Designing Ethical AI ,"""Machine learning failures - for art!"" by Janelle Shane",https://www.youtube.com/watch?v=yneJIxOdMX4
7,Artificial Intelligence,Human-AI Interaction,,12th,English/Hindi,Module 2: Designing Ethical AI ,Understanding the Limitations of AI: When Algorithms Fail | Timnit Gebru | WiDS 2019,https://www.youtube.com/watch?v=Q2CSVYD7pYE
8,Artificial Intelligence,Human-AI Interaction,,12th,English/Hindi,Module 3: Understanding AI Limitations,Will You Accept an Imperfect AI? Exploring Designs for Adjusting End-user Expectations of ...,https://www.youtube.com/watch?v=y-4ZvxPFaCs
9,Artificial Intelligence,Human-AI Interaction,,12th,English/Hindi,Module 3: Understanding AI Limitations,"Alex Hanna, Data, Transparency, and AI Ethics (Ethics of AI in Context)",https://www.youtube.com/watch?v=nBGEsBIjIWo
10,Artificial Intelligence,Human-AI Interaction,,12th,English/Hindi,Module 3: Understanding AI Limitations,Ethically Aligned Design & Applied AI Ethics with John C. Havens,https://www.youtube.com/watch?v=nCtqCvrkiHw
11,Artificial Intelligence,Human-AI Interaction,,12th,English/Hindi,Module 4: Data and AI Ethics,Co-Opting AI: Justice,https://www.youtube.com/watch?v=50_pyFyboYA
12,Artificial Intelligence,Human-AI Interaction,,12th,English/Hindi,Module 4: Data and AI Ethics,Lessons from Archives: Strategies for Collecting Sociocultural Data in Machine Learning,https://www.youtube.com/watch?v=pcajyLGMWUc
13,Artificial Intelligence,Human-AI Interaction,,12th,English/Hindi,Module 4: Data and AI Ethics,Saleema Amershi: Toward Responsible AI by Planning to Fail,https://www.youtube.com/watch?v=uyCaUq4h8D8
14,Artificial Intelligence,Human-AI Interaction,,12th,English/Hindi,Module 5: Societal Impacts of AI,Dataclysm | Christian Rudder | Talks at Google,https://www.youtube.com/watch?v=YX1gTVa1N78
15,Artificial Intelligence,Human-AI Interaction,,12th,English/Hindi,Module 5: Societal Impacts of AI,"OKC's Christian Rudder & ""Dataclysm"" reveal our secret beliefs about race, gender & culture",https://www.youtube.com/watch?v=_islsqquXAo
16,Artificial Intelligence,Human-AI Interaction,,12th,English/Hindi,Module 5: Societal Impacts of AI,Stanford Seminar - Towards Usable Machine Learning,https://www.youtube.com/watch?v=-5ipNPUwMZQ
17,Artificial Intelligence,Human-AI Interaction,,12th,English/Hindi,Module 6: Visualization in AI,WHAT IS THE ROLE OF VISUALIZATION IN PREDICTION?   Adam Perer,https://www.youtube.com/watch?v=viVxZjQFbKI
18,Artificial Intelligence,Human-AI Interaction,,12th,English/Hindi,Module 6: Visualization in AI,Interacting with Predictions: Visual Inspection of Black-box Machine Learning Models,https://www.youtube.com/watch?v=00URhb_PgM0
19,Artificial Intelligence,Human-AI Interaction,,12th,English/Hindi,Module 6: Visualization in AI,Interacting with Predictions: Visual Inspection of Black-box Machine Learning Models,https://www.youtube.com/watch?v=JX2RmYx5qJc
20,Artificial Intelligence,Human-AI Interaction,,12th,English/Hindi,Module 7: Explainable AI ,"Explaining Black-Box Machine Learning Predictions - Sameer Singh, UC Irvine",https://www.youtube.com/watch?v=TBJqgvXYhfo
21,Artificial Intelligence,Human-AI Interaction,,12th,English/Hindi,Module 7: Explainable AI ,Safiya Noble | Challenging the Algorithms of Oppression,https://www.youtube.com/watch?v=iRVZozEEWlE
22,Artificial Intelligence,Human-AI Interaction,,12th,English/Hindi,Module 7: Explainable AI ,Kate Crawford | Know Your Terrorist Credit Score,https://www.youtube.com/watch?v=xXs3c42WP8E
23,Artificial Intelligence,Human-AI Interaction,,12th,English/Hindi,Module 8: Challenging AI Bias,Welcome to CELEBRATE: The College!,https://www.youtube.com/watch?v=0NLFItC-4dA
24,Artificial Intelligence,Human-AI Interaction,,12th,English/Hindi,Module 8: Challenging AI Bias,Gender Shades,https://www.youtube.com/watch?v=TWWsW1w-BVo
25,Artificial Intelligence,Human-AI Interaction,,12th,English/Hindi,Module 8: Challenging AI Bias,3 types of bias in AI | Machine learning,https://www.youtube.com/watch?v=59bMh59JQDo
26,Artificial Intelligence,Human-AI Interaction,,12th,English/Hindi,Module 9: AI and Creativity,Kate Crawford: The Trouble with Bias (NIPS 2017 keynote),https://www.youtube.com/watch?v=ggzWIipKraM
27,Artificial Intelligence,Human-AI Interaction,,12th,English/Hindi,Module 10: Bias in Recommender Systems,Recurrent Neural Networks (RNN) and Long Short-Term Memory (LSTM),https://www.youtube.com/watch?v=WCUNPb-5EYI
28,Artificial Intelligence,Human-AI Interaction,,12th,English/Hindi,Module 10: Bias in Recommender Systems,FAT* 2018: Michael Ekstrand - Popularity and Demographic Biases in Recommender Systems,https://www.youtube.com/watch?v=QFlOBfr_FzA
29,Artificial Intelligence,Human-AI Interaction,,12th,English/Hindi,Module 10: Bias in Recommender Systems,Sunspring | A Sci-Fi Short Film Starring Thomas Middleditch,https://www.youtube.com/watch?v=LY7x2Ihqjmc
30,Artificial Intelligence,Human-AI Interaction,,12th,English/Hindi,Module 11: Recommender Systems in Practice,FATE/CV 2020 | Computer vision in practice: who is benefiting and who is being harmed?,https://www.youtube.com/watch?v=0sBE5OyD7fk
31,Artificial Intelligence,Human-AI Interaction,,12th,English/Hindi,Module 11: Recommender Systems in Practice,How Recommender Systems Work (Netflix/Amazon),https://www.youtube.com/watch?v=n3RKsY2H-NE
32,Artificial Intelligence,Human-AI Interaction,,12th,English/Hindi,Module 11: Recommender Systems in Practice,How YouTube's Suggested Videos Work,https://www.youtube.com/watch?v=E6pC6iql5xM
33,Artificial Intelligence,Human-AI Interaction,,12th,English/Hindi,Module 12: The YouTube Algorithm,Manipulating the YouTube Algorithm - (Part 1/3) Smarter Every Day 213,https://www.youtube.com/watch?v=1PGm8LslEb4
34,Artificial Intelligence,Human-AI Interaction,,12th,English/Hindi,Module 12: The YouTube Algorithm,The nightmare videos of childrens' YouTube — and what's wrong with the internet today | James Bridle,https://www.youtube.com/watch?v=v9EKV2nSU8w
35,Artificial Intelligence,Human-AI Interaction,,12th,English/Hindi,Module 12: The YouTube Algorithm,Recommender Systems,https://www.youtube.com/watch?v=Eeg1DEeWUjA
36,Artificial Intelligence,Human-AI Interaction,,12th,English/Hindi,Module 12: The YouTube Algorithm,RecSys 2016: Paper Session 6 - Deep Neural Networks for YouTube Recommendations,https://www.youtube.com/watch?v=WK_Nr4tUtl8
