S.No.,Sector,CourseName,Duration,Minimum Education,Language,Module,TopicName,URL
1,Law,Administrative Law,12hrs 7min,12th,English/Hindi,Module 1: Introduction to Administrative Law,Meaning | Definition | Sources of Administrative Law,https://www.youtube.com/watch?v=6H7Vqo5A5dQ
2,Law,Administrative Law,,12th,English/Hindi,Module 1: Introduction to Administrative Law,Scope and Reasons for Growth of Administrative Law | Administrative Law,https://www.youtube.com/watch?v=UqFtvgd7TWs
3,Law,Administrative Law,,12th,English/Hindi,Module 1: Introduction to Administrative Law,Rule of Law | Administration Law,https://www.youtube.com/watch?v=uxlXGPBfMTU
4,Law,Administrative Law,,12th,English/Hindi,Module 1: Introduction to Administrative Law,Droit Administratiff | Administrative Law,https://www.youtube.com/watch?v=_1I3gnPhMcc
5,Law,Administrative Law,,12th,English/Hindi,Module 2: Scope and Principles of Administrative Law,Doctrine of Separation of Powers | Administration Law,https://www.youtube.com/watch?v=H0iyVa21vuQ
6,Law,Administrative Law,,12th,English/Hindi,Module 2: Scope and Principles of Administrative Law,"Classification of Administrative Actions, Powers, Functions | Adminisitrative Law",https://www.youtube.com/watch?v=_-DSapNXv6U
7,Law,Administrative Law,,12th,English/Hindi,Module 2: Scope and Principles of Administrative Law,"Judicial Control, Review, Remedies against Administrative Functions | Administrative Law",https://www.youtube.com/watch?v=EgVQF_LepSI
8,Law,Administrative Law,,12th,English/Hindi,Module 3: Administrative Action and Judicial Review,Delegated Legislation | Meaning | Growth | Classifications | Types,https://www.youtube.com/watch?v=_R2Q2apM9oQ
9,Law,Administrative Law,,12th,English/Hindi,Module 3: Administrative Action and Judicial Review,Delegated Legislation | Advantages | Disadvantages | Purpose | Functions can be delegated,https://www.youtube.com/watch?v=21Qe3_kudpc
10,Law,Administrative Law,,12th,English/Hindi,Module 3: Administrative Action and Judicial Review,5 Case Laws on Delegated Legislation | Administration Law,https://www.youtube.com/watch?v=BvhCIfWrPys
11,Law,Administrative Law,,12th,English/Hindi,Module 4: Delegated Legislation and Its Control,Sub delegation | Concept and Case Laws | Administrative Law,https://www.youtube.com/watch?v=KEVzymxIuwE
12,Law,Administrative Law,,12th,English/Hindi,Module 4: Delegated Legislation and Its Control,Doctrine of Ultra Vires | Control and Safeguards of Delegated Legislation | Administrative Law,https://www.youtube.com/watch?v=7xtYM765kww
13,Law,Administrative Law,,12th,English/Hindi,Module 4: Delegated Legislation and Its Control,DOCTRINE OF ULTRA VIRES | Knowledge in a Minute | One Minute Video to Know a Concept,https://www.youtube.com/watch?v=l6BG4bKpTIw
14,Law,Administrative Law,,12th,English/Hindi,Module 4: Delegated Legislation and Its Control,Principle of Natural Justice | Introduction | Administration Law,https://www.youtube.com/watch?v=sTBlkvgxR4I
15,Law,Administrative Law,,12th,English/Hindi,Module 5: Principles of Natural Justice,Doctrine of Bias | Principle of Natural Justice | Administration Law,https://www.youtube.com/watch?v=CNqHO9PGMfo
16,Law,Administrative Law,,12th,English/Hindi,Module 5: Principles of Natural Justice,DOCTRINE OF BIAS | Knowledge in a Minute | One Minute Video to Know a Concept,https://www.youtube.com/watch?v=GGLNQMnF0Z4
17,Law,Administrative Law,,12th,English/Hindi,Module 5: Principles of Natural Justice,Doctrine of Fair Hearing | Principle of Natural Justice | Administration Law,https://www.youtube.com/watch?v=ofG9ZNTNVmo
18,Law,Administrative Law,,12th,English/Hindi,Module 6: Remedies and Liabilities in Administrative Law,DOCTRINE OF FAIR HEARING | Knowledge in a Minute | One Minute Video to Know a Concept,https://www.youtube.com/watch?v=5md0iwl7iXM
19,Law,Administrative Law,,12th,English/Hindi,Module 6: Remedies and Liabilities in Administrative Law,Locus Standi | Administration Law,https://www.youtube.com/watch?v=50gSvETwcM8
20,Law,Administrative Law,,12th,English/Hindi,Module 6: Remedies and Liabilities in Administrative Law,LOCUS STANDI | Knowledge in a Minute | One Minute Video to Know a Concept,https://www.youtube.com/watch?v=iTcXH6XBzcc
21,Law,Administrative Law,,12th,English/Hindi,Module 7: Administrative Discretion and Control,Public Interest Litigation | Administration Law,https://www.youtube.com/watch?v=YenLIG8hdvE
22,Law,Administrative Law,,12th,English/Hindi,Module 7: Administrative Discretion and Control,WRITS | INDIAN CONSTITUTION | CONSTITUTIONAL REMEDIES | INDIAN POLITY | ADMINISTRATION LAW | 5 WRITS,https://www.youtube.com/watch?v=o3Kw4sLd5a4
23,Law,Administrative Law,,12th,English/Hindi,Module 7: Administrative Discretion and Control,5 WRITS | PART 2 | INDIAN CONSTITUTION | CONSTITUTIONAL REMEDIES | INDIAN POLITY,https://www.youtube.com/watch?v=r6Ae0M9Y55o
24,Law,Administrative Law,,12th,English/Hindi,Module 8: Public Corporations and Accountability,State Liability for Contracts | Indian Constitution | Article 298 & 299 | Administration Law,https://www.youtube.com/watch?v=Bsm7KeQLsbU
25,Law,Administrative Law,,12th,English/Hindi,Module 8: Public Corporations and Accountability,State Liability for Torts | Article 300 | Indian Constitution | Administration Law | Indian Polity,https://www.youtube.com/watch?v=sGMTyrCz0mk
26,Law,Administrative Law,,12th,English/Hindi,Module 8: Public Corporations and Accountability,Administrative Discretion | Meaning | Purpose | Types | Administrative Law,https://www.youtube.com/watch?v=5gh7hkMu1Dg
27,Law,Administrative Law,,12th,English/Hindi,Module 9: Ombudsman and Vigilance Mechanisms,Judicial Review (Control) over Administrative Discretion | Administrative Law,https://www.youtube.com/watch?v=bFKepAPv-88
28,Law,Administrative Law,,12th,English/Hindi,Module 9: Ombudsman and Vigilance Mechanisms,Doctrine of Proportionality | Wednesbury Principle | Administrative Discretion | Administrative Law,https://www.youtube.com/watch?v=5AECKpUCOjE
29,Law,Administrative Law,,12th,English/Hindi,Module 10: Exam Strategies for Administrative Law,DOCTRINE OF PROPORTIONALITY | Knowledge in a Minute | One Minute Video to Know a Concept,https://www.youtube.com/watch?v=V0IhePLNT1M
30,Law,Administrative Law,,12th,English/Hindi,Module 10: Exam Strategies for Administrative Law,Doctrine of Legitimate Expectation | Administrative Discretion | Administrative Law,https://www.youtube.com/watch?v=32--vY0juTE
31,Law,Administrative Law,,12th,English/Hindi,Module 10: Exam Strategies for Administrative Law,Public Corporations | Meaning | Features | Advantages | Classifications | Administrative Law,https://www.youtube.com/watch?v=lK8RCRKeipE
32,Law,Administrative Law,,12th,English/Hindi,Module 10: Exam Strategies for Administrative Law,Public Corporations | Rights | Duties | Power | Liabilities | Administrative Law,https://www.youtube.com/watch?v=dU8lEW7bYak
33,Law,Administrative Law,,12th,English/Hindi,Module 10: Exam Strategies for Administrative Law,Control over Public Corporations | Administrative Law,https://www.youtube.com/watch?v=2Ry3YhY12tY
34,Law,Administrative Law,,12th,English/Hindi,Module 10: Exam Strategies for Administrative Law,Ombudsman | Lokpal | Lokayukta | Central Vigilance Commission | Administrative Law,https://www.youtube.com/watch?v=QDLY1P_vsO8
35,Law,Administrative Law,,12th,English/Hindi,Module 10: Exam Strategies for Administrative Law,"HOW TO WRITE LAW EXAMS? Strategy for Preparation, Time Management, Long, Short & Problem Solving",https://www.youtube.com/watch?v=DEjepF86jcI
