S.No.,Sector,CourseName,Duration,Minimum Education,Language,Module,TopicName,URL
1,Renewable Energy,Energy Storage System,20hrs 4min,12th,English/Hindi,Module 1: Pumped Hydro Energy Storage System,pumped hydro energy storage system | pumped hydro storage system | in hindi | hydro power plant,https://www.youtube.com/watch?v=lh_GKJirgBI
2,Renewable Energy,Energy Storage System,,12th,English/Hindi,Module 1: Pumped Hydro Energy Storage System,compressed air energy storage system | in hindi | CAES | working principle | types of energy storage,https://www.youtube.com/watch?v=LKw5KjOr8hw
3,Renewable Energy,Energy Storage System,,12th,English/Hindi,Module 2: Flywheel Energy Storage System,flywheel energy storage system | in hindi | working | animation | energy storage in flywheel | types,https://www.youtube.com/watch?v=oEQWbvqgTjo
4,Renewable Energy,Energy Storage System,,12th,English/Hindi,Module 2: Flywheel Energy Storage System,superconducting magnetic energy storage system | in hindi | SMES | working principle | animation,https://www.youtube.com/watch?v=EOQVHYIONgg
5,Renewable Energy,Energy Storage System,,12th,English/Hindi,Module 3: Double Layer Capacitor / Supercapacitor,double layer capacitor | electric double layer capacitor | super capacitor | in hindi | EDLC | DLC,https://www.youtube.com/watch?v=mE4dfgdiMI0
6,Renewable Energy,Energy Storage System,,12th,English/Hindi,Module 3: Double Layer Capacitor / Supercapacitor,fuel cell | hydrogen fuel cell | fuel cell working | in hindi | electric vehicle | types |animation,https://www.youtube.com/watch?v=imcJzRmxc6c
7,Renewable Energy,Energy Storage System,,12th,English/Hindi,Module 4: Lead Acid Battery,lead acid battery working animation | lead acid battery in hindi | Construction | lead acid battery,https://www.youtube.com/watch?v=Es8GTwSJGQs
