S.No.,Sector,CourseName,Duration,Minimum Education,Language,Module,TopicName,URL
1,Political Science,International Relations | IR FOR UPSC |  FREE UPSC Preparation,50hrs 32min,12th,English/Hindi,Module 1: Overview of International Relations and Key Concepts,India's Bilateral Military Exercises in 2023 | International Relations | OnlyIAS,https://www.youtube.com/watch?v=VBTvFTv7guc
2,Political Science,International Relations | IR FOR UPSC |  FREE UPSC Preparation,,12th,English/Hindi,Module 1: Overview of International Relations and Key Concepts,Indian Diaspora in the World FULL CHAPTER | Chapter 28 | UPSC Preparation,https://www.youtube.com/watch?v=4xKyzDm3jho
3,Political Science,International Relations | IR FOR UPSC |  FREE UPSC Preparation,,12th,English/Hindi,Module 1: Overview of International Relations and Key Concepts,Non Aligned Movement FULL CHAPTER | International Relations Chapter 27 | UPSC Preparation,https://www.youtube.com/watch?v=j9gyGcvbcXU
4,Political Science,International Relations | IR FOR UPSC |  FREE UPSC Preparation,,12th,English/Hindi,Module 1: Overview of International Relations and Key Concepts,"International Treaties ( UNCLOS , ISA ) FULL CHAPTER | International Relations Chapter 26",https://www.youtube.com/watch?v=BpTXTkN43sw
5,Political Science,International Relations | IR FOR UPSC |  FREE UPSC Preparation,,12th,English/Hindi,Module 2: India's Neighborhood First Policy,Terrorism FULL CHAPTER | International Relations Chapter 25 | UPSC Preparation,https://www.youtube.com/watch?v=pEnYEsXYTLI
6,Political Science,International Relations | IR FOR UPSC |  FREE UPSC Preparation,,12th,English/Hindi,Module 2: India's Neighborhood First Policy,"Organisations, Groupings and Institutions of the World FULL CHAPTER | Chapter 24 | UPSC Preparation",https://www.youtube.com/watch?v=thtmxYmHq7o
7,Political Science,International Relations | IR FOR UPSC |  FREE UPSC Preparation,,12th,English/Hindi,Module 2: India's Neighborhood First Policy,Indo-Africa Relations FULL CHAPTER | International Relations Chapter 23 | UPSC Preparation,https://www.youtube.com/watch?v=eQWpo4YDWlo
8,Political Science,International Relations | IR FOR UPSC |  FREE UPSC Preparation,,12th,English/Hindi,Module 2: India's Neighborhood First Policy,Indo-US Relations FULL CHAPTER | International Relations Chapter 22 | UPSC Preparation,https://www.youtube.com/watch?v=pjZ-fvtHFuM
9,Political Science,International Relations | IR FOR UPSC |  FREE UPSC Preparation,,12th,English/Hindi,Module 3: India's Engagement with South Asia and its Extended Neighborhood,India and Europe Relations FULL CHAPTER | International Relations Chapter 21 | UPSC Preparation,https://www.youtube.com/watch?v=kBzKXfH7TDo
10,Political Science,International Relations | IR FOR UPSC |  FREE UPSC Preparation,,12th,English/Hindi,Module 3: India's Engagement with South Asia and its Extended Neighborhood,Indo - Russia Relations FULL CHAPTER | International Relations Chapter 20 | UPSC Preparation,https://www.youtube.com/watch?v=xTzAFJeAmro
11,Political Science,International Relations | IR FOR UPSC |  FREE UPSC Preparation,,12th,English/Hindi,Module 3: India's Engagement with South Asia and its Extended Neighborhood,India and Central Asian Relations FULL CHAPTER | International Relations Chapter 19,https://www.youtube.com/watch?v=0lE-Iup4Qe4
12,Political Science,International Relations | IR FOR UPSC |  FREE UPSC Preparation,,12th,English/Hindi,Module 3: India's Engagement with South Asia and its Extended Neighborhood,India and West Asia FULL CHAPTER | International Relations Chapter 18 | UPSC Preparation,https://www.youtube.com/watch?v=2Jdlom__u-o
13,Political Science,International Relations | IR FOR UPSC |  FREE UPSC Preparation,,12th,English/Hindi,Module 4: India's Relations with Major Powers,Indo Pacific Relations FULL CHAPTER | Internationl Relations  Chapter 17 | UPSC Preparation,https://www.youtube.com/watch?v=sBV2tvP-TA4
14,Political Science,International Relations | IR FOR UPSC |  FREE UPSC Preparation,,12th,English/Hindi,Module 4: India's Relations with Major Powers,Indo-Australia Relations FULL CHAPTER | Chapter 16 | UPSC Preparation,https://www.youtube.com/watch?v=avbuw_G3J2U
15,Political Science,International Relations | IR FOR UPSC |  FREE UPSC Preparation,,12th,English/Hindi,Module 4: India's Relations with Major Powers,India - South Korea Relations FULL CHAPTER | International Relations Chapter 15 | UPSC Preparation,https://www.youtube.com/watch?v=tQ_RICMH5p4
16,Political Science,International Relations | IR FOR UPSC |  FREE UPSC Preparation,,12th,English/Hindi,Module 4: India's Relations with Major Powers,India -Japan Relations FULL CHAPTER | International Relations Chapter 14 | UPSC Preparation,https://www.youtube.com/watch?v=ZjIMFGBTujo
17,Political Science,International Relations | IR FOR UPSC |  FREE UPSC Preparation,,12th,English/Hindi,Module 5: India's Relations with Key Regions and Groupings,India-Asean Relations FULL CHAPTER | International Relations Chapter 13 | UPSC Preparation,https://www.youtube.com/watch?v=fuiRtTlHxJM
18,Political Science,International Relations | IR FOR UPSC |  FREE UPSC Preparation,,12th,English/Hindi,Module 5: India's Relations with Key Regions and Groupings,India-Myanmar Relations FULL CHAPTER | International Relations Chapter 12 | UPSC Preparation,https://www.youtube.com/watch?v=zW_CfGgE2OU
19,Political Science,International Relations | IR FOR UPSC |  FREE UPSC Preparation,,12th,English/Hindi,Module 5: India's Relations with Key Regions and Groupings,Indo-China Relations FULL CHAPTER | International Relations Chapter 11 | UPSC Preparation,https://www.youtube.com/watch?v=VHmtkLnMUCQ
20,Political Science,International Relations | IR FOR UPSC |  FREE UPSC Preparation,,12th,English/Hindi,Module 5: India's Relations with Key Regions and Groupings,India-Afghanistan Relations FULL CHAPTER | International Relations Chapter 10 | UPSC Preparation,https://www.youtube.com/watch?v=lKwxO4HWt4U
21,Political Science,International Relations | IR FOR UPSC |  FREE UPSC Preparation,,12th,English/Hindi,Module 6: Contemporary Issues in International Relations,India-Pakistan Relations FULL CHAPTER | International Relations Chapter 9 | UPSC Preparation,https://www.youtube.com/watch?v=Xji-u607hA4
22,Political Science,International Relations | IR FOR UPSC |  FREE UPSC Preparation,,12th,English/Hindi,Module 6: Contemporary Issues in International Relations,India-Maldives Relations FULL CHAPTER | International Relations Chapter 8 | UPSC Preparation,https://www.youtube.com/watch?v=XPwiw18oXNM
23,Political Science,International Relations | IR FOR UPSC |  FREE UPSC Preparation,,12th,English/Hindi,Module 6: Contemporary Issues in International Relations,Indo-Srilanka Relations FULL CHAPTER | International Relations Chapter 7 | UPSC Preparation,https://www.youtube.com/watch?v=U0URgHaYR-M
24,Political Science,International Relations | IR FOR UPSC |  FREE UPSC Preparation,,12th,English/Hindi,Module 6: Contemporary Issues in International Relations,Indo-Nepal Relations FULL CHAPTER | International Relations Chapter 6 | UPSC Preparation,https://www.youtube.com/watch?v=T2FSGxU26nA
25,Political Science,International Relations | IR FOR UPSC |  FREE UPSC Preparation,,12th,English/Hindi,Module 6: Contemporary Issues in International Relations,Indo-Bhutan Relations FULL CHAPTER | International Relations Chapter 5 | UPSC Preparation,https://www.youtube.com/watch?v=0iY8GOp4I8U
26,Political Science,International Relations | IR FOR UPSC |  FREE UPSC Preparation,,12th,English/Hindi,Module 6: Contemporary Issues in International Relations,Indo - Bangladesh Relations FULL CHAPTER | International Relations Chapter 4 | UPSC Preparation,https://www.youtube.com/watch?v=ijTnkbHms6A
27,Political Science,International Relations | IR FOR UPSC |  FREE UPSC Preparation,,12th,English/Hindi,Module 6: Contemporary Issues in International Relations,Key Terms in International Relations FULL CHAPTER| International Relations Chapter 3 | OnlyIAS,https://www.youtube.com/watch?v=j2Dgo7gx5Sk
28,Political Science,International Relations | IR FOR UPSC |  FREE UPSC Preparation,,12th,English/Hindi,Module 6: Contemporary Issues in International Relations,Evolution of Indian Foreign Policy FULL CHAPTER | International Relations Chapter 2|UPSC Preparation,https://www.youtube.com/watch?v=E7egtczNh6Q
29,Political Science,International Relations | IR FOR UPSC |  FREE UPSC Preparation,,12th,English/Hindi,Module 6: Contemporary Issues in International Relations,Overview of International Relations FULL CHAPTER |International Relations Chapter 1|UPSC Preparation,https://www.youtube.com/watch?v=O_ADoz2YNWM
